{
  "$schema": "http://json-schema.org/draft-04/schema#",
  "type": "object",
  "properties": {
    "name": {
      "type": "string"
    },
    "selector": {
      "type": "string"
    },
    "button": {
      "type": "object",
      "properties": {
        "parentSelector": {
          "type": "string"
        },
        "styleModifier": {
          "type": "string"
        },
        "zIndex": {
          "type": "integer"
        }
      }
    },
    "states": {
      "type": "array",
      "items": [
        {
          "type": "object",
          "properties": {
            "name": {
              "type": "string"
            },
            "options": {
              "type": "array",
              "items": [
                {
                  "type": "object",
                  "properties": {
                    "value": {
                      "type": "string"
                    },
                    "name": {
                      "type": "string"
                    }
                  },
                  "required": ["name"]
                }
              ]
            },
            "multiple": {
              "type": "boolean"
            }
          },
          "required": ["name"]
        }
      ]
    }
  },
  "required": ["name", "selector", "states"]
}
