{
  "name": "Teaser",
  "selector": ".zzz-o-teaser",
  "button": {
    "parentSelector": ".zzz-o-teaser__inner",
    "styleModifier": "pl-state--top-right"
  },
  "states": [
    {
      "name": "Image position",
      "multiple": false,
      "options": [
        {
          "value": "zzz-o-teaser--image-left",
          "name": "Left"
        },
        {
          "value": "zzz-o-teaser--image-right",
          "name": "Right"
        }
      ]
    }
  ]
}
