[
  {
    "name": "Contact",
    "selector": ".zzz-o-contact",
    "button": {
      "parentSelector": ".zzz-o-contact__main",
      "styleModifier": "pl-state--top-right"
    },
    "states": [
      {
        "name": "Map position",
        "multiple": false,
        "options": [
          {
            "value": "zzz-o-contact--map-left",
            "name": "Left"
          },
          {
            "value": "zzz-o-contact--map-right",
            "name": "Right"
          }
        ]
      }
    ]
  },
  {
    "name": "Teaser",
    "selector": ".zzz-o-teaser",
    "button": {
      "parentSelector": ".zzz-o-teaser__inner",
      "styleModifier": "pl-state--top-right"
    },
    "states": [
      {
        "name": "Image position",
        "multiple": false,
        "options": [
          {
            "value": "zzz-o-teaser--image-left",
            "name": "Left"
          },
          {
            "value": "zzz-o-teaser--image-right",
            "name": "Right"
          }
        ]
      }
    ]
  }
]